index,rule,file,match_count,matched_text,text
1,secret_word2,sample_data/Screenshot 2025-07-30 175255.png,9,delta,"PROBLEMS @ OUTPUT DEBUG CONSOLE TERMINAL PORTS  © user@ubuntu-pe:~/security-projects/0CRacle$ git push Enumerazione degli oggetti in corso: 7, fatto. Conteggio degli oggetti in corso: 100% (7/7), fatto. Compressione delta in corso, uso fino a 4 thread Compressione oggetti in corso: 100% (4/4), fatto. Scrittura degli oggetti in corso: 100% (4/4), 1.09 MiB | 27.83 MiB/s, fatto. 4 oggetti totali (1 delta), @ riutilizzati (@ delta), @ riutilizzati nel file pack remote: Resolving deltas: 100% (1/1), completed with 1 local object. To https: //github.com/FreeDurok/OCRacle.git 75126e4..c6354bf main -> main © user@ubuntu-pe:~/security-projects/OCRacle$ git add . && git commit -m ""Update"" && git push [main bf2c956] Update 1 file changed, 1 insertion(+), 1 deletion(-) Enumerazione degli oggetti in corso: 5, fatto. Conteggio degli oggetti in corso: 100% (5/5), fatto. Compressione delta in corso, uso fino a 4 thread Compressione oggetti in corso: 100% (3/3), fatto. Scrittura degli oggetti in corso: 100% (3/3), 302 byte | 302.00 KiB/s, fatto. 3 oggetti totali (2 delta), © riutilizzati (0 delta), 6 riutilizzati nel file pack remote: Resolving deltas: 100% (2/2), completed with 2 local objects. To https: //github.com/FreeDurok/OCRacle.git c6354bf..bf2c956 main -> main © user@ubuntu-pe:~/security-projects/OCRacle$ git add . && git commit -m ""Update"" && git push [main 9817457] Update 4 files changed, 10 insertions(+), 10 deletions(-) Enumerazione degli oggetti in corso: 13, fatto. Conteggio degli oggetti in corso: 100% (13/13), fatto. Compressione delta in corso, uso fino a 4 thread Compressione oggetti in corso: 100% (7/7), fatto. Scrittura degli oggetti in corso: 100% (7/7), 719 byte | 719.00 KiB/s, fatto. 7 oggetti totali (5 delta), @ riutilizzati (@ delta), @ riutilizzati nel file pack remote: Resolving deltas: 100% (5/5), completed with 5 local objects. To https: //github.com/FreeDurok/OCRacle.git bf2c956..981f457 main -> main  "
2,secret_word5,sample_data/archive/images/3.png,1,TRABAJO,"‘CONTRATO DE TRABAJO PARALAFORMACION VEL APRENOAAE  el on M* (AAmEN TENGERD DAE, Teac | rommeTOAn [Semen mp Sc re Pramcues 12. Pe esoas (0 Roce hieallei.005)} oe i) = esomoa TO rmwancjos: [uuunn) Rae ine PciwAD TEMDCRO [oowcee  [ieuens — barra bron funn) Tinea jos Toni [uns]  Sierra Bane —  ths  "
3,secret_word5,sample_data/archive/images/1.jpg,6,TRABAJO; trabajo,"OTRO si DEL CONTRATO DE TRABAJO PARA LA REALIZACION DE UNA OBRA O LABOR CONTRATADA PARA TRABAJADORA EN MISION CELEBRADO ENTRE SANTIAGO ANDRES PEREZ ARISTIZABAL Y GENTE DISPONIBLE S.A.  Entre los suscritos, EDWIN FERNANDO MARTINEZ, mayor de edad, domiciliado en Bogoté, D.C., identificado con Cédula de Ciudadania No 80.192.414 expedida en Bogota, actuando en nombre y representacion de GENTE DISPONIBLE S.A. en su condicién de EMPLEADOR y SANTIAGO ANDRES PEREZ ARISTIZABAL también mayor de edad, identificado con la Cédula de Ciudadania No. 1019112650 en su condicién de TRABAJADOR EN MISION para el CLIENTE CARACOL TELEVISION S.A., conforme al contrato de trabajo suscrito el 23 de febrero de 2021 para el cargo de Asistente de Audio, han acordado aclarar los términos del contrato de trabajo vigente entre las mismas en lo que se refiere a la remuneracién y fecha de ingreso, dejando constancia expresa que éstas condiciones no constituyen desmejora en la remuneracion ni en las condiciones generales de trabajo del empleado y que por el contrario, el TRABAJADOR EN MISION consiente libre y expresamente en ellas.  PRIMERO: Acuerdan las partes modificar a partir del 15 de marzo de 2021 Ia forma para la retribucién pactada en la clausula tercera del contrato primitivo que se transmuta de la modalidad  de salario diario proporcional por la labor efectivamente prestada a una remuneracién basica mensual.  SEGUNDO: EL TRABAJADOR EN MISION devengara como contraprestacién por sus servicios a partir del 15 de marzo de 2021, un salario mensual que asciende a la suma de UN MILLON CIEN MIL PESOS ($1.100.000.00) que sera cancelado por quincenas vencidas.  TERCERO: Para efectos de no desconocer los valores correspondientes al acumulado de los factores de némina, las partes acuerdan hacer la ficcién legal DE TERMINAR EL CONTRATO DE TRABAJO el 15 de marzo de 2021 conforme a Ia liquidacién laboral que hace parte de este documento, que el TRABAJADOR declara haber recibido mediante transferencia electronica que acompafia éste acuerdo. Por lo anterior, si bien la seguridad social continua sin solucién de continuidad, con la fecha inicial del contrato primitivo, para los demas efectos legales y prestacionales, LA FECHA DE INGRESO SERA A PARTIR DEL 15 DE MARZO DE 2021. i= TRABAJADOR desde ya, renuncia reciamar ajustes 0 pago de prestaciones sociales sobre los valores anticipados que los esta recibiendo conforme lo ordena Ia ley.  Se aclara y conviene que el 80% de cualquier retribucién variable que perciba EL TRABAJADOR EN MISION, retribuye el servicio prestado y el 20 % restante retribuye el valor del descanso en aquellos dias en que la Ley sefiala que sean obligatorios y remunerados asi como el 35% correspondiente al recargo nocturno, en el evento de que éste se causare, obre la parte variable del salario. Con base a la bilateralidad y consensualidad que informan el presente contrato de trabajo, las partes de comin acuerdo convienen y aclaran que dentro de las comisiones, bonificaciones e incentivos que reciba como salario variable, esta incluida la remuneracién  correspondiente al descanso semanal obligatorio y festivo y al recargo noctuno en caso de laborarios.  PAGOS QUE NO CONSTITUYEN SALARIO. Haciendo uso de Ia facultad que les confiere el Articulo 15 y siguientes de la Ley 50 de 1.990,las partes convienen expresamente que cualquier  "
4,secret_word5,sample_data/archive/images/0.jpg,2,TRABAJO; trabajo,"70 INDIVIDUAL DE TRABAJO A Té CONTRAT™ ""NFERIOR A UN ANO 2015 ERMINO FI39  voc a saber VILMA LORENA PARADA SIERRA, m Entre los susertos ® amo aparece al pie de su firma, quien obra como ayor de edad  Y vecino di 4, identifica i REPRES| . ae BOGOTA ARTE CONTEMPORANEO BAG, sociedad domi: au ioe LEGAL sane ry # 57 53 ¥ quien para efectos del presente contrato se got, NO  rte y por la otra LUIS EDUARDO BARRERO CORDOBA dee EL aparece al ple de su firma, domiciliado en Bogota - Cundinamarca y ubicado en la Cr 5 Fie oe Sur quien en Jo sucesivo Se llamara el TRABAJADOR, se ha celebrado el presente contrato  individual de trabajo, regido ademas por las siguientes clausulas: indivi 1  q EADOR contrata los servicios personales del TI 4 PRIMERA: OBJETO. EL EMPL! pales del TRABAIADOR obliga: a) 2 poner al servicio del EMPLEADOR toda su capacidad normal de Sate e s desempefio de las funciones propias del oficio como DOMICILIARIO Y MENSAJERO y en (Gs labores anexas y complementa 5 de mo, de confo ss  imparta EL EMPLEADOR en forma exclusiva  e instrucciones que le @ prestar sus servicios lente servicios laborales ‘durante Ja vigencia de  ‘L EMPLEADOR; y c) a 30s, informaciones y en Or causa 0 con ocasion  jor la prestacion de sus  ) MIL TRESCIENTOS ada mes y un Auxilio intro de este pago se jos de que tratan los  / se conviene que en los  a modalidad de salario or realizada, y el 17.5% y festivos de que tratan partes jacuerdan que en | salario por concepto de eraran tales beneficios  "
5,secret_word4,sample_data/archive/boxes/2.png,3,CONTRAENTE,"Neto Cristovdo Ernesto Jodo Vula, de nacionalidade mocambicana, titular do Bilhete de Identidade n.2070101743169C , daqui em diante  SEGUNDO  k celebrado 0 presente contrato de trabalho a prazo incerto que se rege pelas clausulas  feguintes e pela legislaco aplicavel:  CLAUSULA PRIMEIRA  (Objecto) 1. O SEGUNDO CONTRAENTE 6 admitido para desempenhar as fungdes de Ensacador de bens e produtos alimentares para transporte. 2. No entanto, o SEGUNDO CONTRAENTE desde J@ da 0 seu acordo para a execucdo de  tarefas no abrangidas pelas funcdes inerentes a sua categoria profissional quando o  interesse da PRIMEIRA CONTRAENTE assim o exija.  "
6,secret_word5,sample_data/archive/boxes/0.png,2,TRABAJO; trabajo,"70 INDIVIDUAL DE TRABAJO a TE CONTRAT® ‘NFERIOR A UN ANO 2015 TERMINO F130  “3c g saber VILMA LORENA PARADA SIERRA, m ie Heats como aparece al pie de su firma, quien obra como iREDRESRS Y Vecino de TA ARTE CONTEMPORANEO BAG, sociedad domiciliada TANTE LEGAL ry # 57 53 Y quien para efectos del presente contrato se got, NO por la otra LUIS EDUARDO BARRERO CORDOBA idence EL como.  me al pie ; laCr SN ieee en lo sucesivo se llamara el TRABAJADOR, se ha celebrado el presente al individual de trabajo, regido ademas por las siguientes clausulas: ato)  : OBJETO. EL EMPLEADOR contrata los servicios personales del TRABAJAD r sree ‘a poner al servicio del EMPLEADOR toda su capacidad normal de mao a tGesempefio de las funciones propias del oficio como DOMICILIARIO Y MENSAJERO y en las labores lanexas y complementall el mismo, de CO imparta EL EMPLEAD en forma exclusiva  otros EMPLEA  enes e instrucciones que le )) a prestar sus servicios Nente servicios laborales: durante Ja vigencia de EL EMPLEADOR; y c) a 0s, informaciones y en,  Or causa 0 con ocasior  r la prestacin de sus MIL TRESCIENTOS  io  intro de este pago se os de que tratan los  y se conviene que en los modalidad de salario  r realizada, y el 17.5% y festivos de que tratan partes acuerdan que en  I salario’ por concepto de deraran tales beneficios  "
7,secret_word5,sample_data/archive/boxes/1.png,6,TRABAJO; trabajo,"OTRO si DEL CONTRATO DE TRABAJO PARA LA REALIZACION DE UNA OBRA O LABOR CONTRATADA PARA TRABAJADORA EN MISION CELEBRADO ENTRE SANTIAGO ANDRES PEREZ ARISTIZABAL Y GENTE DISPONIBLE S.A.  Entre los suscritos, EDWIN FERNANDO MARTINEZ, mayor de edad, domiciliado en Bogoté, D.C., identificado con Cédula de Ciudadania No 80.192.414 expedida en Bogotd, actuando en nombre y representacion de GENTE DISPONIBLE S.A. en su condicién de EMPLEADOR y SANTIAGO ANDRES PEREZ ARISTIZABAL también mayor de edad, identificado con la Cédula de Ciudadania No. 1019112650 en su condicién de TRABAJADOR EN MISION para el CLIENTE CARACOL TELEVISION S.A., conforme al contrato de trabajo suscrito el 23 de febrero de 2021 para el cargo de Asistente de Audio, han acordado aclarar los términos del contrato de trabajo vigente entre las mismas en lo que se refiere a la remuneracién y fecha de ingreso, dejando constancia expresa que éstas condiciones no constituyen desmejora en la remuneracién ni en las  condiciones generales de trabajo del empleado y que por el contrario, el TRABAJADOR EN MISION consiente libre y expresamente en ellas.  RIMERO: Acuerdan las partes modificar a partir del 15 de marzo de 2021 la forma para la retribucién pactada en la clausula tercera del contrato primitivo que se transmuta de la modalidad  de salario diario proporcional por la labor efectivamente prestada a una remuneracién basica mensual.  SEGUNDO: EL TRABAJADOR EN MISION devengara como contraprestacién por sus servicios a partir del 15 de marzo de 2021, un salario mensual que asciende a la suma de UN MILLON CIEN MIL PESOS ($1.100.000.00) que sera cancelado por quincenas vencidas.  ERCERO: Para efectos de no desconocer los valores correspondientes al acumulado de los factores de némina, las partes acuerdan hacer la ficcién legal DE TERMINAR EL CONTRATO DE TRABAJO el 15 de marzo de 2021 conforme a Ia liquidacién laboral que hace parte de este documento, que el TRABAJADOR declara haber recibido mediante transferencia electrénica que acompafia éste acuerdo. Por lo anterior, si bien la seguridad social continua sin solucién de continuidad, con la fecha inicial del contrato primitivo, para los demas efectos legales y prestacionales, LA FECHA DE INGRESO SERA A PARTIR DEL 15 DE MARZO DE 2021. El TRABAJADOR desde ya, renuncia reclamar ajustes 0 pago de prestaciones sociales sobre los valores anticipados que los esta recibiendo conforme lo ordena la ley.  Se aclara y conviene que el 80% de cualquier retribucién variable que perciba EL TRABAJADOR EN MISION, retribuye el servicio prestado y el 20 % restante retribuye el valor del descanso en aquellos dias en que la Ley sefiala que sean obligatorios y remunerados asi como el 35% correspondiente al recargo nocturno, en el evento de que éste se causare, obre la parte variable del salario. Con base a la bilateralidad y consensualidad que informan el presente contrato de trabajo, las partes de comin acuerdo convienen y aclaran que dentro de las comisiones, bonificaciones e incentivos que reciba como salario variable, esta incluida la remuneracion  correspondiente al descanso semanal obligatorio y festivo y al recargo noctuno en caso de laborarlos.  PAGOS QUE NO CONSTITUYEN SALARIO. Haciendo uso de Ia facultad que les confiere el Articulo 15 y siguientes de la Ley 50 de 1.990,las partes convienen expresamente que cualquie!  "
